{
  "kind": "autonomy-constitution",
  "schema_version": "v2",
  "constitution_id": "grimnir-autonomy-v2",
  "issued_at": "2026-07-27T00:00:00Z",
  "promotion_mode": "mechanical-for-covered-classes-only",
  "protected_lanes": [
    "credentials-and-auth",
    "owner-policy",
    "constitution-and-safety-gates",
    "deployments-and-code",
    "privacy-retention-and-erasure",
    "firmware",
    "remote-recovery",
    "model-weight-training",
    "irreversible-external-actions",
    "package-downgrade"
  ],
  "safety_floors": {
    "fail_closed": true,
    "kill_switch": true,
    "fresh_evidence": true,
    "unique_identity": true,
    "content_blind_journal": true,
    "observer_cannot_actuate": true,
    "unknown_disarms": true,
    "success_preserves_arming": true,
    "recovery_worker_disarms": true,
    "coverage_widening_owner_controlled": true,
    "recovery_worker_may_only_narrow": true,
    "protected_lanes_never_promote": true
  },
  "autonomous_classes": [
    {
      "class": "micro-routing",
      "required_for_levels": [
        "L4",
        "L5"
      ],
      "owner_scope": "fixed-component",
      "owner": "gille-inference",
      "owner_binding_source": "owner-controlled-coverage-registry",
      "admission": "mechanical-after-all-predicates",
      "recovery_class": "R-exact",
      "bounds": {
        "max_concurrent_targets": 1,
        "canary_only_until_armed_fleet": true,
        "apply_verify_budget_seconds": 300,
        "minimum_watch_seconds": 3600,
        "commit_grace_seconds": 300,
        "deadline_seconds": 4200,
        "max_attempts": 1,
        "min_seconds_between_attempts": 3600,
        "max_attempts_per_window": 1,
        "attempt_window_seconds": 86400,
        "max_silence_seconds": 900,
        "trusted_watchdog_time_required": true
      },
      "required_identity_roles": [
        "owner",
        "controller",
        "watchdog",
        "kill-switch",
        "recovery-worker"
      ],
      "success_postconditions": [
        "verifier-passes",
        "canary-watch-complete",
        "micro-route-readback-matches-candidate"
      ],
      "recovery_postconditions": [
        "baseline-digest-restored",
        "coverage-demoted-to-shadow",
        "recovery-worker-disarm-confirmed"
      ],
      "fault_injection_requirements": [
        "executor-interruption",
        "observer-cannot-actuate",
        "recovery-path-proven",
        "recovery-failure-disarms",
        "stale-evidence-rejected",
        "chain-tamper-rejected",
        "late-mutation-rejected",
        "kill-switch-rejected"
      ]
    },
    {
      "class": "macro-routing",
      "required_for_levels": [
        "L5"
      ],
      "owner_scope": "fixed-component",
      "owner": "hugin",
      "owner_binding_source": "owner-controlled-coverage-registry",
      "admission": "mechanical-after-all-predicates",
      "recovery_class": "R-exact",
      "bounds": {
        "max_concurrent_targets": 1,
        "canary_only_until_armed_fleet": true,
        "apply_verify_budget_seconds": 300,
        "minimum_watch_seconds": 3600,
        "commit_grace_seconds": 300,
        "deadline_seconds": 4200,
        "max_attempts": 1,
        "min_seconds_between_attempts": 3600,
        "max_attempts_per_window": 1,
        "attempt_window_seconds": 86400,
        "max_silence_seconds": 900,
        "trusted_watchdog_time_required": true
      },
      "required_identity_roles": [
        "owner",
        "controller",
        "watchdog",
        "kill-switch",
        "recovery-worker"
      ],
      "success_postconditions": [
        "verifier-passes",
        "canary-watch-complete",
        "macro-route-readback-matches-candidate"
      ],
      "recovery_postconditions": [
        "baseline-digest-restored",
        "coverage-demoted-to-shadow",
        "recovery-worker-disarm-confirmed"
      ],
      "fault_injection_requirements": [
        "executor-interruption",
        "observer-cannot-actuate",
        "recovery-path-proven",
        "recovery-failure-disarms",
        "stale-evidence-rejected",
        "chain-tamper-rejected",
        "late-mutation-rejected",
        "kill-switch-rejected"
      ]
    },
    {
      "class": "prompt",
      "required_for_levels": [
        "L5"
      ],
      "owner_scope": "owning-component",
      "owner": "owning-component",
      "owner_binding_source": "owner-controlled-coverage-registry",
      "admission": "mechanical-after-all-predicates",
      "recovery_class": "R-exact",
      "bounds": {
        "max_concurrent_targets": 1,
        "canary_only_until_armed_fleet": true,
        "apply_verify_budget_seconds": 300,
        "minimum_watch_seconds": 3600,
        "commit_grace_seconds": 300,
        "deadline_seconds": 4200,
        "max_attempts": 1,
        "min_seconds_between_attempts": 3600,
        "max_attempts_per_window": 1,
        "attempt_window_seconds": 86400,
        "max_silence_seconds": 900,
        "trusted_watchdog_time_required": true
      },
      "required_identity_roles": [
        "owner",
        "controller",
        "watchdog",
        "kill-switch",
        "recovery-worker"
      ],
      "success_postconditions": [
        "verifier-passes",
        "canary-watch-complete",
        "prompt-config-readback-matches-candidate"
      ],
      "recovery_postconditions": [
        "baseline-digest-restored",
        "coverage-demoted-to-shadow",
        "recovery-worker-disarm-confirmed"
      ],
      "fault_injection_requirements": [
        "executor-interruption",
        "observer-cannot-actuate",
        "recovery-path-proven",
        "recovery-failure-disarms",
        "stale-evidence-rejected",
        "chain-tamper-rejected",
        "late-mutation-rejected",
        "kill-switch-rejected"
      ]
    },
    {
      "class": "harness",
      "required_for_levels": [
        "L5"
      ],
      "owner_scope": "owning-component",
      "owner": "owning-component",
      "owner_binding_source": "owner-controlled-coverage-registry",
      "admission": "mechanical-after-all-predicates",
      "recovery_class": "R-exact",
      "bounds": {
        "max_concurrent_targets": 1,
        "canary_only_until_armed_fleet": true,
        "apply_verify_budget_seconds": 300,
        "minimum_watch_seconds": 3600,
        "commit_grace_seconds": 300,
        "deadline_seconds": 4200,
        "max_attempts": 1,
        "min_seconds_between_attempts": 3600,
        "max_attempts_per_window": 1,
        "attempt_window_seconds": 86400,
        "max_silence_seconds": 900,
        "trusted_watchdog_time_required": true
      },
      "required_identity_roles": [
        "owner",
        "controller",
        "watchdog",
        "kill-switch",
        "recovery-worker"
      ],
      "success_postconditions": [
        "verifier-passes",
        "canary-watch-complete",
        "harness-config-readback-matches-candidate"
      ],
      "recovery_postconditions": [
        "baseline-digest-restored",
        "coverage-demoted-to-shadow",
        "recovery-worker-disarm-confirmed"
      ],
      "fault_injection_requirements": [
        "executor-interruption",
        "observer-cannot-actuate",
        "recovery-path-proven",
        "recovery-failure-disarms",
        "stale-evidence-rejected",
        "chain-tamper-rejected",
        "late-mutation-rejected",
        "kill-switch-rejected"
      ]
    },
    {
      "class": "tool-policy",
      "required_for_levels": [
        "L5"
      ],
      "owner_scope": "owning-component",
      "owner": "owning-component",
      "owner_binding_source": "owner-controlled-coverage-registry",
      "admission": "mechanical-after-all-predicates",
      "recovery_class": "R-exact",
      "bounds": {
        "max_concurrent_targets": 1,
        "canary_only_until_armed_fleet": true,
        "apply_verify_budget_seconds": 300,
        "minimum_watch_seconds": 3600,
        "commit_grace_seconds": 300,
        "deadline_seconds": 4200,
        "max_attempts": 1,
        "min_seconds_between_attempts": 3600,
        "max_attempts_per_window": 1,
        "attempt_window_seconds": 86400,
        "max_silence_seconds": 900,
        "trusted_watchdog_time_required": true
      },
      "required_identity_roles": [
        "owner",
        "controller",
        "watchdog",
        "kill-switch",
        "recovery-worker"
      ],
      "success_postconditions": [
        "verifier-passes",
        "canary-watch-complete",
        "tool-policy-readback-matches-candidate"
      ],
      "recovery_postconditions": [
        "baseline-digest-restored",
        "coverage-demoted-to-shadow",
        "recovery-worker-disarm-confirmed"
      ],
      "fault_injection_requirements": [
        "executor-interruption",
        "observer-cannot-actuate",
        "recovery-path-proven",
        "recovery-failure-disarms",
        "stale-evidence-rejected",
        "chain-tamper-rejected",
        "late-mutation-rejected",
        "kill-switch-rejected"
      ]
    },
    {
      "class": "served-model-roster",
      "required_for_levels": [
        "L5"
      ],
      "owner_scope": "fixed-component",
      "owner": "gille-inference",
      "owner_binding_source": "owner-controlled-coverage-registry",
      "admission": "mechanical-after-all-predicates",
      "recovery_class": "R-exact",
      "bounds": {
        "max_concurrent_targets": 1,
        "canary_only_until_armed_fleet": true,
        "apply_verify_budget_seconds": 300,
        "minimum_watch_seconds": 3600,
        "commit_grace_seconds": 300,
        "deadline_seconds": 4200,
        "max_attempts": 1,
        "min_seconds_between_attempts": 3600,
        "max_attempts_per_window": 1,
        "attempt_window_seconds": 86400,
        "max_silence_seconds": 900,
        "trusted_watchdog_time_required": true
      },
      "required_identity_roles": [
        "owner",
        "controller",
        "watchdog",
        "kill-switch",